{
  "song": "Test",
  "artist": "Generated",
  "duration_sec": 15.0,
  "bpm": 117.45,
  "bpm_confidence": 1.0,
  "time_signature": "4/4",
  "beats": [
    1.0216780045351475,
    1.5325170068027212,
    2.020136054421769,
    2.5309750566893423,
    3.01859410430839,
    3.5294331065759637,
    4.017052154195011,
    4.527891156462585,
    5.015510204081632,
    5.526349206349207,
    6.013968253968254,
    6.524807256235827,
    7.035646258503402,
    7.523265306122449,
    8.034104308390022,
    8.52172335600907,
    9.032562358276644,
    9.520181405895691,
    10.031020408163265,
    10.518639455782314,
    11.029478458049887,
    11.517097505668934,
    12.027936507936507,
    12.515555555555556,
    13.02639455782313,
    13.514013605442177,
    14.02485260770975
  ],
  "downbeats": [
    1.0216780045351475,
    3.01859410430839,
    5.015510204081632,
    7.035646258503402,
    9.032562358276644,
    11.029478458049887,
    13.02639455782313
  ],
  "onsets": [
    0.5108390022675737,
    1.0216780045351475,
    1.509297052154195,
    2.020136054421769,
    2.507755102040816,
    3.01859410430839,
    3.5062131519274375,
    4.017052154195011,
    4.527891156462585,
    5.015510204081632,
    5.526349206349207,
    6.013968253968254,
    6.524807256235827,
    7.012426303854875,
    7.523265306122449,
    8.010884353741497,
    8.52172335600907,
    9.009342403628118,
    9.520181405895691,
    10.00780045351474,
    10.518639455782314,
    11.00625850340136,
    11.517097505668934,
    12.027936507936507,
    12.515555555555556,
    13.02639455782313,
    13.514013605442177,
    14.02485260770975,
    14.512471655328799
  ],
  "drops": [
    {
      "time": 7.454,
      "intensity": 1.0,
      "type": "main_drop"
    }
  ],
  "buildups": [
    {
      "start": 0.0,
      "end": 7.454,
      "curve": "linear"
    }
  ],
  "breakdowns": [
    {
      "start": 0.0,
      "end": 6.966,
      "intensity": 0.045
    },
    {
      "start": 9.056,
      "end": 14.977,
      "intensity": 0.043
    }
  ],
  "energy_curve": [
    [
      0.0,
      0.047
    ],
    [
      1.0,
      0.047
    ],
    [
      2.0,
      0.047
    ],
    [
      3.0,
      0.047
    ],
    [
      4.0,
      0.047
    ],
    [
      5.0,
      0.046
    ],
    [
      6.0,
      0.052
    ],
    [
      7.0,
      0.987
    ],
    [
      8.0,
      1.0
    ],
    [
      9.0,
      0.076
    ],
    [
      10.0,
      0.047
    ],
    [
      11.0,
      0.046
    ],
    [
      12.0,
      0.046
    ],
    [
      13.0,
      0.047
    ],
    [
      14.0,
      0.046
    ],
    [
      15.0,
      0.0
    ]
  ]
}